{
  "$schema": "https://json-schema.org/draft/2020-12/schema",
  "type": "object",
  "properties": {
    "identity": {
      "type": "object",
      "properties": {
        "symbol": {
          "type": "string"
        },
        "legacyId": {
          "anyOf": [
            {
              "type": "integer",
              "minimum": -9007199254740991,
              "maximum": 9007199254740991
            },
            {
              "type": "null"
            }
          ]
        },
        "aliases": {
          "anyOf": [
            {
              "type": "array",
              "items": {
                "type": "string"
              }
            },
            {
              "type": "null"
            }
          ]
        }
      },
      "required": [
        "symbol"
      ],
      "additionalProperties": false
    },
    "tracks": {
      "type": "object",
      "properties": {
        "underlying": {
          "anyOf": [
            {
              "type": "string",
              "minLength": 1
            },
            {
              "type": "null"
            }
          ]
        },
        "asset": {
          "anyOf": [
            {
              "type": "string",
              "minLength": 1
            },
            {
              "type": "null"
            }
          ]
        },
        "structure": {
          "description": "a slug of registry/reference/vocabularies/asset-class.json",
          "type": "string",
          "pattern": "^[a-z0-9]+(-[a-z0-9]+)*$"
        }
      },
      "required": [
        "structure"
      ],
      "additionalProperties": false
    },
    "terms": {
      "type": "object",
      "properties": {
        "collateral": {
          "anyOf": [
            {
              "type": "string",
              "minLength": 1
            },
            {
              "type": "null"
            }
          ]
        },
        "pair": {
          "anyOf": [
            {
              "type": "string"
            },
            {
              "type": "null"
            }
          ]
        },
        "makerFeeBps": {
          "anyOf": [
            {
              "type": "number"
            },
            {
              "type": "null"
            }
          ]
        },
        "takerFeeBps": {
          "anyOf": [
            {
              "type": "number"
            },
            {
              "type": "null"
            }
          ]
        }
      },
      "additionalProperties": false
    },
    "about": {
      "type": "object",
      "properties": {
        "description": {
          "anyOf": [
            {
              "type": "string"
            },
            {
              "type": "null"
            }
          ]
        },
        "website": {
          "anyOf": [
            {
              "type": "string"
            },
            {
              "type": "null"
            }
          ]
        },
        "issuer": {
          "anyOf": [
            {
              "type": "string"
            },
            {
              "type": "null"
            }
          ]
        }
      },
      "additionalProperties": false
    },
    "roles": {
      "type": "array",
      "items": {
        "type": "object",
        "properties": {
          "organization": {
            "type": "string",
            "minLength": 1
          },
          "kind": {
            "description": "a slug of registry/reference/vocabularies/role-kind.json",
            "type": "string",
            "pattern": "^[a-z0-9]+(-[a-z0-9]+)*$"
          },
          "from": {
            "anyOf": [
              {
                "type": "string",
                "format": "date",
                "pattern": "^(?:(?:\\d\\d[2468][048]|\\d\\d[13579][26]|\\d\\d0[48]|[02468][048]00|[13579][26]00)-02-29|\\d{4}-(?:(?:0[13578]|1[02])-(?:0[1-9]|[12]\\d|3[01])|(?:0[469]|11)-(?:0[1-9]|[12]\\d|30)|(?:02)-(?:0[1-9]|1\\d|2[0-8])))$"
              },
              {
                "type": "null"
              }
            ]
          },
          "to": {
            "anyOf": [
              {
                "type": "string",
                "format": "date",
                "pattern": "^(?:(?:\\d\\d[2468][048]|\\d\\d[13579][26]|\\d\\d0[48]|[02468][048]00|[13579][26]00)-02-29|\\d{4}-(?:(?:0[13578]|1[02])-(?:0[1-9]|[12]\\d|3[01])|(?:0[469]|11)-(?:0[1-9]|[12]\\d|30)|(?:02)-(?:0[1-9]|1\\d|2[0-8])))$"
              },
              {
                "type": "null"
              }
            ]
          },
          "sourceLinks": {
            "anyOf": [
              {
                "type": "array",
                "items": {
                  "type": "string"
                }
              },
              {
                "type": "null"
              }
            ]
          },
          "protocolIds": {
            "anyOf": [
              {
                "type": "array",
                "items": {
                  "anyOf": [
                    {
                      "type": "integer",
                      "minimum": -9007199254740991,
                      "maximum": 9007199254740991
                    },
                    {
                      "type": "string",
                      "pattern": "^parent#[a-z0-9-]+$"
                    }
                  ]
                }
              },
              {
                "type": "null"
              }
            ]
          }
        },
        "required": [
          "organization",
          "kind"
        ],
        "additionalProperties": false
      }
    },
    "events": {
      "type": "array",
      "items": {
        "type": "object",
        "properties": {
          "kind": {
            "description": "a slug of registry/reference/vocabularies/event-kind.json",
            "type": "string",
            "pattern": "^[a-z0-9]+(-[a-z0-9]+)*$"
          },
          "date": {
            "anyOf": [
              {
                "type": "string",
                "format": "date",
                "pattern": "^(?:(?:\\d\\d[2468][048]|\\d\\d[13579][26]|\\d\\d0[48]|[02468][048]00|[13579][26]00)-02-29|\\d{4}-(?:(?:0[13578]|1[02])-(?:0[1-9]|[12]\\d|3[01])|(?:0[469]|11)-(?:0[1-9]|[12]\\d|30)|(?:02)-(?:0[1-9]|1\\d|2[0-8])))$"
              },
              {
                "type": "null"
              }
            ]
          },
          "successor": {
            "anyOf": [
              {
                "type": "object",
                "properties": {
                  "table": {
                    "type": "string",
                    "enum": [
                      "vocabulary",
                      "organization",
                      "underlying",
                      "instrument",
                      "venue",
                      "asset",
                      "deployment",
                      "perp_market",
                      "role",
                      "event",
                      "address_label",
                      "ack",
                      "key_change"
                    ]
                  },
                  "key": {
                    "type": "string"
                  }
                },
                "required": [
                  "table",
                  "key"
                ],
                "additionalProperties": false
              },
              {
                "type": "null"
              }
            ]
          },
          "outcome": {
            "anyOf": [
              {
                "type": "string",
                "enum": [
                  "suspicious",
                  "cleared"
                ]
              },
              {
                "type": "null"
              }
            ]
          },
          "reason": {
            "anyOf": [
              {
                "type": "string"
              },
              {
                "type": "null"
              }
            ]
          },
          "links": {
            "anyOf": [
              {
                "type": "array",
                "items": {
                  "type": "string"
                }
              },
              {
                "type": "null"
              }
            ]
          },
          "note": {
            "anyOf": [
              {
                "type": "string"
              },
              {
                "type": "null"
              }
            ]
          }
        },
        "required": [
          "kind"
        ],
        "additionalProperties": false
      }
    }
  },
  "required": [
    "identity",
    "tracks"
  ],
  "additionalProperties": false
}
