{
  "identity": {
    "symbol": "NCSKEXPE2USD-USDT",
    "legacyId": 9684
  },
  "tracks": {
    "underlying": "expedia-group-inc",
    "structure": "stock-perp"
  },
  "terms": {
    "collateral": "usdt",
    "pair": "EXPE-USDT"
  },
  "about": {
    "description": "EXPE is a single-stock perpetual listed on BingX, tracking Expedia Group, Inc., margined and cash-settled in USDT. Traders get synthetic price exposure only - no ownership, dividend or voting rights in the underlying. Funding settles every 8h. Margin is custodied by the exchange rather than self custodied, and access requires exchange onboarding with identity verification."
  }
}
