{
  "identity": {
    "symbol": "BKNGSTOCK_USDT",
    "legacyId": 5835
  },
  "tracks": {
    "underlying": "booking-holdings-inc",
    "structure": "stock-perp"
  },
  "terms": {
    "collateral": "usdt",
    "pair": "BKNG-USDT"
  },
  "about": {
    "description": "BKNG is a single-stock perpetual listed on MEXC, tracking Booking Holdings Inc., margined and cash-settled in USDT. Traders get synthetic price exposure only - no ownership, dividend or voting rights in the underlying. Funding settles every 8h. Up to 20x leverage. Margin is custodied by the exchange rather than self custodied, and access requires exchange onboarding with identity verification."
  }
}
