{
  "identity": {
    "symbol": "NETEASEUSDT",
    "legacyId": 6735
  },
  "tracks": {
    "underlying": "netease-inc",
    "structure": "stock-perp"
  },
  "terms": {
    "collateral": "usdt",
    "pair": "NETEASE-USDT"
  },
  "about": {
    "description": "NETEASE is a single-stock perpetual listed on Bitget, tracking NetEase, Inc., margined and cash-settled in USDT. Traders get synthetic price exposure only - no ownership, dividend or voting rights in the underlying. Funding settles every 8h. Up to 5x leverage. Margin is custodied by the exchange rather than self custodied, and access requires exchange onboarding with identity verification."
  },
  "events": [
    {
      "kind": "delisting",
      "date": null,
      "note": "last stored day not given at import"
    }
  ]
}
