{
  "identity": {
    "symbol": "FUJIKURASTOCK_USDT",
    "legacyId": 9540
  },
  "tracks": {
    "underlying": "fujikura-ltd",
    "structure": "stock-perp"
  },
  "terms": {
    "collateral": "usdt",
    "pair": "FUJIKURA-USDT",
    "makerFeeBps": 0,
    "takerFeeBps": 2
  },
  "about": {
    "description": "MTSI is a single-stock perpetual listed on MEXC, tracking MACOM Technology Solutions Holdings, Inc., margined and cash-settled in USDT. Traders get synthetic price exposure only — no ownership, dividend or voting rights in the underlying. Funding settles every 8h. Up to 20× leverage. Margin is custodied by the exchange rather than self custodied, and access requires exchange onboarding with identity verification."
  }
}
