{
  "identity": {
    "symbol": "FLYUSDT",
    "legacyId": 6215
  },
  "tracks": {
    "underlying": "firefly-aerospace-inc",
    "structure": "stock-perp"
  },
  "terms": {
    "collateral": "usdt",
    "pair": "FLY-USDT"
  },
  "about": {
    "description": "FLY is a single-stock perpetual listed on Bybit, tracking Firefly Aerospace Inc., margined and cash-settled in USDT. Traders get synthetic price exposure only — no ownership, dividend or voting rights in the underlying. Funding settles every 8h. Up to 20× leverage. Margin is custodied by the exchange rather than self custodied, and access requires exchange onboarding with identity verification."
  },
  "events": [
    {
      "kind": "listing",
      "date": "2026-07-20",
      "links": [
        "https://api.bybit.com/v5/market/instruments-info?category=linear"
      ]
    }
  ]
}
