{
  "identity": {
    "symbol": "XCUUSDT",
    "legacyId": 5075
  },
  "tracks": {
    "underlying": "copper",
    "structure": "commodity-perp"
  },
  "terms": {
    "collateral": "usdt",
    "pair": "XCU-USDT"
  },
  "about": {
    "description": "XCU is a commodity perpetual listed on LBank and tracking Copper. The contract is cash settled in USDT and does not convey ownership or delivery of the underlying. Funding is exchanged every 4h. Margin is held by the exchange rather than self custodied, and access requires exchange onboarding with identity verification."
  }
}
