{
  "identity": {
    "symbol": "MRVLUSDT",
    "legacyId": 6639
  },
  "tracks": {
    "underlying": "marvell-technology-inc",
    "structure": "stock-perp"
  },
  "terms": {
    "collateral": "usdt",
    "pair": "MRVL-USDT"
  },
  "about": {
    "description": "MRVL is a single-stock perpetual listed on Bybit, tracking Marvell Technology, Inc., margined and cash-settled in USDT. Traders get synthetic price exposure only - no ownership, dividend or voting rights in the underlying. Funding settles every 8h. Up to 50x leverage. Margin is custodied by the exchange rather than self custodied, and access requires exchange onboarding with identity verification."
  },
  "events": [
    {
      "kind": "listing",
      "date": "2026-05-13",
      "links": [
        "https://api.bybit.com/v5/market/instruments-info?category=linear"
      ]
    }
  ]
}
