{
  "identity": {
    "symbol": "BACSTOCK_USDT",
    "legacyId": 5804
  },
  "tracks": {
    "underlying": "bank-of-america-corporation",
    "structure": "stock-perp"
  },
  "terms": {
    "collateral": "usdt",
    "pair": "BAC-USDT"
  },
  "about": {
    "description": "BAC is a single-stock perpetual listed on MEXC, tracking Bank of America Corporation, margined and cash-settled in USDT. Traders get synthetic price exposure only - no ownership, dividend or voting rights in the underlying. Funding settles every 8h. Up to 100x leverage. Margin is custodied by the exchange rather than self custodied, and access requires exchange onboarding with identity verification."
  }
}
