{
  "identity": {
    "symbol": "ASTSUSDTM",
    "legacyId": 5743
  },
  "tracks": {
    "underlying": "ast-spacemobile-inc",
    "structure": "stock-perp"
  },
  "terms": {
    "collateral": "usdt",
    "pair": "ASTS-USDT"
  },
  "about": {
    "description": "ASTS is a single-stock perpetual listed on KuCoin, tracking AST SpaceMobile, Inc., margined and cash-settled in USDT. Traders get synthetic price exposure only - no ownership, dividend or voting rights in the underlying. Funding settles every 8h. Up to 20x leverage. Margin is custodied by the exchange rather than self custodied, and access requires exchange onboarding with identity verification."
  }
}
