{
  "identity": {
    "symbol": "NCSKBSP2USD-USDT",
    "legacyId": 5880
  },
  "tracks": {
    "underlying": "bending-spoons-s-p-a",
    "structure": "stock-perp"
  },
  "terms": {
    "collateral": "usdt",
    "pair": "BSP-USDT"
  },
  "about": {
    "description": "BSP is a single-stock perpetual listed on BingX, tracking Bending Spoons S.p.A., margined and cash-settled in USDT. Traders get synthetic price exposure only — no ownership, dividend or voting rights in the underlying. Funding settles every 8h. Margin is custodied by the exchange rather than self custodied, and access requires exchange onboarding with identity verification."
  }
}
