{
  "identity": {
    "symbol": "EHUSDT",
    "legacyId": 6172
  },
  "tracks": {
    "underlying": "ehang-holdings-limited",
    "structure": "stock-perp"
  },
  "terms": {
    "collateral": "usdt",
    "pair": "EH-USDT"
  },
  "about": {
    "description": "EH is a single-stock perpetual listed on Bitget, tracking EHang Holdings Limited, margined and cash-settled in USDT. Traders get synthetic price exposure only — no ownership, dividend or voting rights in the underlying. Funding settles every 8h. Up to 20× leverage. Margin is custodied by the exchange rather than self custodied, and access requires exchange onboarding with identity verification."
  },
  "events": [
    {
      "kind": "delisting",
      "date": null,
      "note": "last stored day not given at import"
    }
  ]
}
