{
  "identity": {
    "symbol": "ALB_USDT",
    "legacyId": 5615
  },
  "tracks": {
    "underlying": "albemarle-corporation",
    "structure": "stock-perp"
  },
  "terms": {
    "collateral": "usdt",
    "pair": "ALB-USDT"
  },
  "about": {
    "description": "ALB is a single-stock perpetual listed on Gate, tracking Albemarle Corp., margined and cash-settled in USDT. Traders get synthetic price exposure only — no ownership, dividend or voting rights in the underlying. Funding settles every 8h. Up to 20× leverage. Margin is custodied by the exchange rather than self custodied, and access requires exchange onboarding with identity verification."
  },
  "events": [
    {
      "kind": "listing",
      "date": "2026-04-28",
      "links": [
        "https://api.gateio.ws/api/v4/futures/usdt/contracts"
      ]
    }
  ]
}
