{
  "identity": {
    "symbol": "SKHY_USDT",
    "legacyId": 7104
  },
  "tracks": {
    "underlying": "sk-hynix-inc-adr",
    "structure": "stock-perp"
  },
  "terms": {
    "collateral": "usdt",
    "pair": "SKHY-USDT"
  },
  "about": {
    "description": "SKHY is a single-stock perpetual listed on Gate, tracking SK hynix Inc. ADR, margined and cash-settled in USDT. Traders get synthetic price exposure only — no ownership, dividend or voting rights in the underlying. Funding settles every 8h. Up to 50× leverage. Margin is custodied by the exchange rather than self custodied, and access requires exchange onboarding with identity verification."
  },
  "events": [
    {
      "kind": "listing",
      "date": "2026-07-03",
      "links": [
        "https://api.gateio.ws/api/v4/futures/usdt/contracts"
      ]
    }
  ]
}
