{
  "identity": {
    "symbol": "MRVL-USDT",
    "legacyId": 6643
  },
  "tracks": {
    "underlying": "marvell-technology-inc",
    "structure": "stock-perp"
  },
  "terms": {
    "collateral": "usdt",
    "pair": "MRVL-USDT",
    "makerFeeBps": 2,
    "takerFeeBps": 6
  },
  "about": {
    "description": "MRVL is a single-stock perpetual listed on HTX, tracking Marvell Technology, Inc., margined and cash-settled in USDT. Traders get synthetic price exposure only - no ownership, dividend or voting rights in the underlying. Funding settles every 8h. Margin is custodied by the exchange rather than self custodied, and access requires exchange onboarding with identity verification."
  }
}
