{
  "identity": {
    "symbol": "TEMSTOCK_USDT",
    "legacyId": 7253
  },
  "tracks": {
    "underlying": "tempus-ai-inc",
    "structure": "stock-perp"
  },
  "terms": {
    "collateral": "usdt",
    "pair": "TEM-USDT"
  },
  "about": {
    "description": "TEM is a single-stock perpetual listed on MEXC, tracking Tempus AI, Inc., margined and cash-settled in USDT. Traders get synthetic price exposure only — no ownership, dividend or voting rights in the underlying. Funding settles every 8h. Up to 20× leverage. Margin is custodied by the exchange rather than self custodied, and access requires exchange onboarding with identity verification."
  }
}
