{
  "identity": {
    "symbol": "CRWDUSDT",
    "legacyId": 6070
  },
  "tracks": {
    "underlying": "crowdstrike-holdings-inc",
    "structure": "stock-perp"
  },
  "terms": {
    "collateral": "usdt",
    "pair": "CRWD-USDT"
  },
  "about": {
    "description": "CRWD is a single-stock perpetual listed on Phemex, tracking CrowdStrike Holdings, Inc., margined and cash-settled in USDT. Traders get synthetic price exposure only - no ownership, dividend or voting rights in the underlying. Funding settles every 8h. Up to 10x leverage. Margin is custodied by the exchange rather than self custodied, and access requires exchange onboarding with identity verification."
  }
}
