{
  "identity": {
    "symbol": "ORCLUSDT",
    "legacyId": 4882
  },
  "tracks": {
    "underlying": "oracle-corporation",
    "structure": "stock-perp"
  },
  "terms": {
    "collateral": "usdt",
    "pair": "ORCL-USDT",
    "makerFeeBps": 0,
    "takerFeeBps": 4
  },
  "about": {
    "description": "ORCL is a single-stock perpetual listed on Binance and tracking Oracle Corp. The contract is cash settled in USDT against a Binance price index and does not convey ownership of the underlying. Funding is exchanged every 8h. Margin is held by the exchange rather than self custodied, and access requires exchange onboarding with identity verification."
  },
  "events": [
    {
      "kind": "listing",
      "date": "2026-05-15",
      "links": [
        "https://fapi.binance.com/fapi/v1/exchangeInfo"
      ]
    }
  ]
}
