{
  "identity": {
    "symbol": "AEHR-USD",
    "legacyId": 8903
  },
  "tracks": {
    "underlying": "aehr-test-systems",
    "structure": "stock-perp"
  },
  "terms": {
    "collateral": "usdc",
    "pair": "AEHR-USD"
  },
  "about": {
    "description": "Single-stock perpetual futures market on QFEX tracking Aehr Test Systems, quoted in USD, cross-margined in USDC and trading 24/7 with up to 10x leverage. QFEX is a hybrid central-limit-order-book exchange for traditional assets only; positions are cash-settled and confer no ownership, dividend or voting rights in the underlying. Reference prices are consumed from primary venues during the instrument's published reference-price hours and funding is zero outside them."
  }
}
