{
  "identity": {
    "symbol": "NASDAQ100-USDT",
    "legacyId": 6714
  },
  "tracks": {
    "underlying": "nasdaq-100-index",
    "structure": "equity-index-perp"
  },
  "terms": {
    "collateral": "usdt",
    "pair": "NASDAQ100-USDT",
    "makerFeeBps": 2,
    "takerFeeBps": 6
  },
  "about": {
    "description": "NASDAQ100 is an index perpetual listed on HTX, tracking Nasdaq-100 Index, margined and cash-settled in USDT. Traders get synthetic price exposure only — no ownership, dividend or voting rights in the underlying. Funding settles every 1h. Margin is custodied by the exchange rather than self custodied, and access requires exchange onboarding with identity verification."
  }
}
